{
  "schema_version": 1,
  "capture_manifest": "target/tactical-scene-captures/environment-review-.../manifest.json",
  "scope": {
    "environment_only": true,
    "excluded": ["characters", "volumetric-clouds", "caves", "weather", "water"]
  },
  "items": [
    {
      "id": "example-replace-me",
      "area": "terrain",
      "critique": "Replace with one evidence-backed visual defect.",
      "evidence": ["fixture/time/view.png"],
      "severity_before": "UNASSESSABLE",
      "severity_after": "UNASSESSABLE",
      "coverage_gap": "Replace with the missing view, or null once assessable.",
      "candidates": [],
      "triage": "coverage-blocked",
      "acceptance": "Same-camera evidence is assessable and independent reassessment lowers severity without semantic regression."
    }
  ],
  "stop_decision": {
    "ready_to_stop": false,
    "reason": "Review and triage have not run."
  }
}
